{"v":1,"type":"trial_header","trial_id":"mujoco-101-5f428a24","seed":101,"code_git_sha":"5c31f07ea76c4ec253ce052b9cdc1c6c37847810-dirty","engine":{"name":"mujoco","version":"3.11.0"},"sweep_point":{"outer_occlusion":0.0,"inner_occlusion":0.0,"illuminance_lux":41000,"rain":0.0,"dropout_p":0.0,"lens_contamination":0.0,"host_pitch_deg":0.0,"host_roll_deg":0.0,"tag_knockout_mask":0,"attempts_per_encounter":3,"speed_outer_ms":1.0,"speed_inner_ms":0.2,"speed_insertion_ms":0.05,"mu_contact":0.4,"restitution_e":0.2,"perception_rate_hz":30,"perception_latency_ms":30,"chassis_error_scale":1.0,"conf_min_attempt":0.85,"time_budget_min":15,"mud_f_c":0.8,"flip_kappa":1.0,"stiffness_k_n_mm":10.0,"head_mass_kg":15.0,"curve_set":"prior_v1"},"params_ref":"PHASE1_PARAMETERS.md","solver":{"timestep_s":0.0002,"integrator":"implicitfast","solver_iterations":100}}
